{
  "preview": 1,
  "kind": "audio",
  "summary": "Example preview: 3.0 s mono 440 Hz tone at 24 kHz, integrated loudness -18.6 LUFS.",
  "duration_s": 3.0,
  "sample_rate_hz": 24000,
  "channels": 1,
  "waveform": {
    "bins": 1200,
    "min": [
      -0.5,
      -0.5439,
      -0.5873,
      -0.6296,
      -0.6704,
      -0.7091,
      -0.7452,
      -0.7785,
      -0.8083,
      -0.8344,
      -0.8565,
      -0.8742,
      -0.8875,
      -0.896,
      -0.8998,
      -0.8987,
      -0.8929,
      -0.8822,
      -0.867,
      -0.8473,
      -0.8234,
      -0.7956,
      -0.7642,
      -0.7297,
      -0.6923,
      -0.6527,
      -0.6112,
      -0.5683,
      -0.5246,
      -0.5194,
      -0.5631,
      -0.6061,
      -0.6478,
      -0.6877,
      -0.7253,
      -0.7603,
      -0.792,
      -0.8203,
      -0.8446,
      -0.8648,
      -0.8806,
      -0.8918,
      -0.8983,
      -0.8999,
      -0.8967,
      -0.8888,
      -0.8761,
      -0.8588,
      -0.8373,
      -0.8116,
      -0.7822,
      -0.7494,
      -0.7136,
      -0.6751,
      -0.6346,
      -0.5924,
      -0.5491,
      -0.5053,
      -0.5387,
      -0.5821,
      -0.6246,
      -0.6656,
      -0.7046,
      -0.7411,
      -0.7746,
      -0.8049,
      -0.8315,
      -0.8541,
      -0.8724,
      -0.8861,
      -0.8953,
      -0.8996,
      -0.8991,
      -0.8938,
      -0.8837,
      -0.869,
      -0.8499,
      -0.8265,
      -0.7991,
      -0.7682,
      -0.734,
      -0.6969,
      -0.6575,
      -0.6162,
      -0.5735,
      -0.5299,
      -0.5141,
      -0.5579,
      -0.601,
      -0.6429,
      -0.683,
      -0.721,
      -0.7562,
      -0.7884,
      -0.8171,
      -0.8419,
      -0.8627,
      -0.879,
      -0.8907,
      -0.8978,
      -0.9,
      -0.8974,
      -0.89,
      -0.8778,
      -0.8611,
      -0.8401,
      -0.8149,
      -0.7859,
      -0.7535,
      -0.718,
      -0.6799,
      -0.6396,
      -0.5976,
      -0.5544,
      -0.5105,
      -0.5334,
      -0.577,
      -0.6196,
      -0.6608,
      -0.7,
      -0.7368,
      -0.7708,
      -0.8015,
      -0.8285,
      -0.8516,
      -0.8704,
      -0.8847,
      -0.8944,
      -0.8993,
      -0.8994,
      -0.8947,
      -0.8852,
      -0.871,
      -0.8524,
      -0.8295,
      -0.8026,
      -0.7721,
      -0.7382,
      -0.7015,
      -0.6624,
      -0.6212,
      -0.5787,
      -0.5351,
      -0.5088,
      -0.5527,
      -0.5959,
      -0.6379,
      -0.6783,
      -0.7165,
      -0.7522,
      -0.7847,
      -0.8138,
      -0.8392,
      -0.8604,
      -0.8773,
      -0.8896,
      -0.8972,
      -0.9,
      -0.898,
      -0.8911,
      -0.8795,
      -0.8634,
      -0.8428,
      -0.8181,
      -0.7896,
      -0.7576,
      -0.7224,
      -0.6846,
      -0.6445,
      -0.6027,
      -0.5596,
      -0.5158,
      -0.5282,
      -0.5718,
      -0.6146,
      -0.6559,
      -0.6954,
      -0.7326,
      -0.7669,
      -0.798,
      -0.8255,
      -0.849,
      -0.8684,
      -0.8833,
      -0.8935,
      -0.899,
      -0.8997,
      -0.8955,
      -0.8866,
      -0.873,
      -0.8549,
      -0.8325,
      -0.806,
      -0.7759,
      -0.7424,
      -0.706,
      -0.6672,
      -0.6263,
      -0.5838,
      -0.5404,
      -0.5035,
      -0.5474,
      -0.5907,
      -0.633,
      -0.6736,
      -0.7121,
      -0.748,
      -0.781,
      -0.8105,
      -0.8363,
      -0.8581,
      -0.8755,
      -0.8883,
      -0.8965,
      -0.8999,
      -0.8985,
      -0.8922,
      -0.8812,
      -0.8656,
      -0.8455,
      -0.8213,
      -0.7932,
      -0.7616,
      -0.7268,
      -0.6892,
      -0.6494,
      -0.6077,
      -0.5648,
      -0.5211,
      -0.5229,
      -0.5666,
      -0.6095,
      -0.6511,
      -0.6908,
      -0.7282,
      -0.7629,
      -0.7944,
      -0.8224,
      -0.8464,
      -0.8663,
      -0.8817,
      -0.8925,
      -0.8986,
      -0.8999,
      -0.8963,
      -0.8879,
      -0.8749,
      -0.8573,
      -0.8354,
      -0.8094,
      -0.7797,
      -0.7466,
      -0.7106,
      -0.6719,
      -0.6313,
      -0.589,
      -0.5456,
      -0.5017,
      -0.5422,
      -0.5856,
      -0.628,
      -0.6688,
      -0.7076,
      -0.7439,
      -0.7772,
      -0.8072,
      -0.8335,
      -0.8557,
      -0.8736,
      -0.8871,
      -0.8958,
      -0.8998,
      -0.8989,
      -0.8932,
      -0.8827,
      -0.8677,
      -0.8481,
      -0.8244,
      -0.7968,
      -0.7655,
      -0.7311,
      -0.6938,
      -0.6543,
      -0.6128,
      -0.57,
      -0.5264,
      -0.5176,
      -0.5614,
      -0.6044,
      -0.6462,
      -0.6862,
      -0.7239,
      -0.7589,
      -0.7908,
      -0.8192,
      -0.8438,
      -0.8641,
      -0.8801,
      -0.8915,
      -0.8981,
      -0.9,
      -0.897,
      -0.8892,
      -0.8767,
      -0.8596,
      -0.8382,
      -0.8127,
      -0.7834,
      -0.7507,
      -0.715,
      -0.6767,
      -0.6362,
      -0.5941,
      -0.5509,
      -0.507,
      -0.5369,
      -0.5804,
      -0.623,
      -0.664,
      -0.7031,
      -0.7397,
      -0.7734,
      -0.8038,
      -0.8305,
      -0.8532,
      -0.8717,
      -0.8857,
      -0.895,
      -0.8995,
      -0.8992,
      -0.8941,
      -0.8842,
      -0.8697,
      -0.8507,
      -0.8275,
      -0.8003,
      -0.7695,
      -0.7354,
      -0.6984,
      -0.6591,
      -0.6179,
      -0.5752,
      -0.5316,
      -0.5124,
      -0.5562,
      -0.5993,
      -0.6412,
      -0.6815,
      -0.7195,
      -0.7549,
      -0.7872,
      -0.816,
      -0.841,
      -0.8619,
      -0.8784,
      -0.8904,
      -0.8976,
      -0.9,
      -0.8976,
      -0.8904,
      -0.8784,
      -0.8619,
      -0.841,
      -0.816,
      -0.7871,
      -0.7548,
      -0.7194,
      -0.6814,
      -0.6412,
      -0.5992,
      -0.5561,
      -0.5123,
      -0.5317,
      -0.5753,
      -0.6179,
      -0.6592,
      -0.6985,
      -0.7354,
      -0.7695,
      -0.8003,
      -0.8275,
      -0.8507,
      -0.8697,
      -0.8843,
      -0.8941,
      -0.8992,
      -0.8995,
      -0.895,
      -0.8857,
      -0.8717,
      -0.8532,
      -0.8305,
      -0.8037,
      -0.7733,
      -0.7396,
      -0.703,
      -0.6639,
      -0.6229,
      -0.5804,
      -0.5369,
      -0.5071,
      -0.5509,
      -0.5942,
      -0.6363,
      -0.6768,
      -0.7151,
      -0.7508,
      -0.7835,
      -0.8128,
      -0.8382,
      -0.8596,
      -0.8767,
      -0.8892,
      -0.897,
      -0.9,
      -0.8981,
      -0.8915,
      -0.8801,
      -0.8641,
      -0.8437,
      -0.8192,
      -0.7908,
      -0.7589,
      -0.7238,
      -0.6861,
      -0.6461,
      -0.6043,
      -0.5613,
      -0.5176,
      -0.5264,
      -0.5701,
      -0.6129,
      -0.6543,
      -0.6939,
      -0.7311,
      -0.7656,
      -0.7968,
      -0.8245,
      -0.8482,
      -0.8677,
      -0.8828,
      -0.8932,
      -0.8989,
      -0.8998,
      -0.8958,
      -0.887,
      -0.8736,
      -0.8557,
      -0.8334,
      -0.8071,
      -0.7772,
      -0.7438,
      -0.7075,
      -0.6687,
      -0.6279,
      -0.5855,
      -0.5421,
      -0.5018,
      -0.5457,
      -0.5891,
      -0.6313,
      -0.672,
      -0.7106,
      -0.7467,
      -0.7797,
      -0.8094,
      -0.8354,
      -0.8573,
      -0.8749,
      -0.8879,
      -0.8963,
      -0.8999,
      -0.8986,
      -0.8925,
      -0.8817,
      -0.8663,
      -0.8464,
      -0.8223,
      -0.7944,
      -0.7629,
      -0.7282,
      -0.6907,
      -0.651,
      -0.6094,
      -0.5665,
      -0.5228,
      -0.5212,
      -0.5649,
      -0.6078,
      -0.6495,
      -0.6893,
      -0.7268,
      -0.7616,
      -0.7933,
      -0.8213,
      -0.8456,
      -0.8656,
      -0.8812,
      -0.8922,
      -0.8985,
      -0.8999,
      -0.8965,
      -0.8883,
      -0.8755,
      -0.858,
      -0.8363,
      -0.8105,
      -0.7809,
      -0.748,
      -0.712,
      -0.6735,
      -0.6329,
      -0.5907,
      -0.5474,
      -0.5035,
      -0.5405,
      -0.5839,
      -0.6263,
      -0.6672,
      -0.7061,
      -0.7425,
      -0.776,
      -0.8061,
      -0.8325,
      -0.8549,
      -0.873,
      -0.8866,
      -0.8955,
      -0.8997,
      -0.899,
      -0.8935,
      -0.8832,
      -0.8683,
      -0.849,
      -0.8254,
      -0.7979,
      -0.7668,
      -0.7325,
      -0.6954,
      -0.6559,
      -0.6145,
      -0.5717,
      -0.5281,
      -0.5159,
      -0.5597,
      -0.6027,
      -0.6445,
      -0.6846,
      -0.7225,
      -0.7576,
      -0.7896,
      -0.8182,
      -0.8429,
      -0.8634,
      -0.8796,
      -0.8911,
      -0.898,
      -0.9,
      -0.8972,
      -0.8896,
      -0.8772,
      -0.8604,
      -0.8391,
      -0.8138,
      -0.7847,
      -0.7521,
      -0.7165,
      -0.6782,
      -0.6379,
      -0.5958,
      -0.5526,
      -0.5087,
      -0.5352,
      -0.5787,
      -0.6213,
      -0.6624,
      -0.7016,
      -0.7383,
      -0.7721,
      -0.8027,
      -0.8295,
      -0.8524,
      -0.8711,
      -0.8852,
      -0.8947,
      -0.8994,
      -0.8993,
      -0.8944,
      -0.8847,
      -0.8704,
      -0.8515,
      -0.8285,
      -0.8014,
      -0.7707,
      -0.7368,
      -0.6999,
      -0.6607,
      -0.6195,
      -0.5769,
      -0.5333,
      -0.5106,
      -0.5545,
      -0.5976,
      -0.6396,
      -0.6799,
      -0.7181,
      -0.7536,
      -0.786,
      -0.815,
      -0.8401,
      -0.8612,
      -0.8779,
      -0.89,
      -0.8974,
      -0.9,
      -0.8978,
      -0.8907,
      -0.879,
      -0.8626,
      -0.8419,
      -0.817,
      -0.7883,
      -0.7562,
      -0.7209,
      -0.6829,
      -0.6428,
      -0.6009,
      -0.5578,
      -0.514,
      -0.53,
      -0.5736,
      -0.6163,
      -0.6576,
      -0.697,
      -0.734,
      -0.7682,
      -0.7992,
      -0.8265,
      -0.8499,
      -0.8691,
      -0.8838,
      -0.8938,
      -0.8991,
      -0.8996,
      -0.8953,
      -0.8861,
      -0.8723,
      -0.854,
      -0.8314,
      -0.8049,
      -0.7746,
      -0.741,
      -0.7045,
      -0.6655,
      -0.6245,
      -0.5821,